<?xml version="1.0" encoding="UTF-8"?>
<!DOCTYPE web-flow PUBLIC "-//ERVACON//DTD SPRING WEB FLOW//EN" "http://www.ervacon.com/dtd/web-flow.dtd">

<web-flow name="Search Stock Flow">
	
	<start-state state="criteria"/>

	<view-state id="criteria" view="criteria">
		<transition name="search" to="validateCriteria"/>
		<transition name="stop" to="endOk"/>
	</view-state>
	
	<action-state id="validateCriteria">
		<action name="bindAct" bean="bindCriteriaAction"/>
		<action name="validateAct" bean="validateCriteriaAction"/>
		<transition name="bindAct.error" to="criteria"/>
		<transition name="validateAct.ok" to="doSearch"/>
		<transition name="validateAct.error" to="criteria"/>
	</action-state>
	
	<action-state id="doSearch">
		<action name="doSearchAct" bean="searchAction"/>
		<transition name="doSearchAct.ok" to="results"/>
		<transition name="doSearchAct.error" to="endError"/>
	</action-state>

	<view-state id="results" view="results">
		<transition name="newSearch" to="criteria"/>
		<transition name="detail" to="bindSelection"/>
		<transition name="stop" to="endOk"/>
	</view-state>
	
	<action-state id="bindSelection">
		<action name="bindAct" bean="bindSelectionAction"/>
		<transition name="bindAct.ok" to="stockDetail"/>
		<transition name="bindAct.error" to="endError"/>
	</action-state>
	
	<flow-state id="stockDetail" flow="stockDetailFlow" model-mapper="stockDetailModelMapper">
		<transition name="endOk" to="results"/>
		<transition name="endError" to="endError"/>
	</flow-state>
	
	<end-state id="endOk"/>
	<end-state id="endError" view="error"/>
	
</web-flow>