<?xml version="1.0" encoding="UTF-8"?>
<!DOCTYPE web-flow PUBLIC "-//ERVACON//DTD SPRING WEB FLOW//EN" "http://www.ervacon.com/dtd/web-flow.dtd">

<!-- 
	This simple flow demonstrates the use of the SimpleFormAction: a multi-action
	that allows you to mimic the exact behaviour of the SimpleFormController in a flow.
	Notice how all the actions use the same "birthDateFormAction" bean, which groups
	all actions executed by this flow in single class!
	
	Note that this flow implements the exact flow of the SimpleFormController as an example.
	If you only need this flow, it is advised that you just use the SimpleFormController.
-->
<web-flow name="Birth Date Flow">

	<start-state state="prepareNewForm"/>
	
	<!--
		Prepare to display a new form. This is very similar to the showNewForm() method
		of the SimpleFormController: it basically initializes the binder so that all property
		editors are available for form display.
	-->
	<action-state id="prepareNewForm">
		<action name="prepare" bean="birthDateFormAction"/>
		<transition name="prepare.ok" to="formView"/>
	</action-state>
	
	<!--
		Display the input form view.
	-->
	<view-state id="formView" view="enterBirthDate">
		<transition name="submit" to="bindAndValidate"/>
	</view-state>
	
	<!--
		Bind and validate input data from the form. This is similar to the bindAndValidate()
		method of the SimpleFormController.
	-->
	<action-state id="bindAndValidate">
		<action name="bindAndValidate" bean="birthDateFormAction"/>
		<transition name="bindAndValidate.ok" to="calculateAge"/>
		<transition name="bindAndValidate.error" to="formView"/>
	</action-state>
	
	<!--
		Process a successful submit. This is similar to the onSubmit() method of the
		SimpleFormController.
	-->
	<action-state id="calculateAge">
		<action name="calculateAge" bean="birthDateFormAction"/>
		<transition name="calculateAge.ok" to="successView"/>
	</action-state>
	
	<!--
		Display the success view.
	-->
	<end-state id="successView" view="displayAge"/>

</web-flow>